{
    "$schema": "https://json-schema.org/draft/2020-12/schema",
    "$id": "https://ilc-protocol.org/schemas/ilc_receipt_schema_v0.1.json",
    "title": "ILC Receipt Schema v0.1",
    "description": "Canonical schema for ILC protocol receipts, tracking outcomes and payouts.",
    "type": "object",
    "required": [
        "receipt_id",
        "protocol_version",
        "timestamp",
        "related_claim_id",
        "outcome",
        "payouts"
    ],
    "additionalProperties": false,
    "properties": {
        "protocol_version": {
            "type": "string",
            "const": "v0.1"
        },
        "receipt_id": {
            "type": "string",
            "pattern": "^[a-f0-9]{64}$",
            "description": "Unique SHA-256 identifier for this receipt."
        },
        "timestamp": {
            "type": "string",
            "format": "date-time",
            "pattern": "^\\d{4}-\\d{2}-\\d{2}T\\d{2}:\\d{2}:\\d{2}Z$",
            "description": "ISO-8601 UTC timestamp of receipt generation."
        },
        "related_claim_id": {
            "type": "string",
            "pattern": "^[a-f0-9]{64}$",
            "description": "ID of the claim this receipt resolves."
        },
        "outcome": {
            "type": "string",
            "enum": [
                "valid",
                "invalid",
                "ambiguous"
            ],
            "description": "Final consensus outcome of the claim."
        },
        "evidence_cids": {
            "type": "array",
            "items": {
                "type": "string"
            },
            "description": "List of IPFS CIDs or hashes for supporting evidence."
        },
        "payouts": {
            "type": "array",
            "items": {
                "type": "object",
                "required": [
                    "recipient_agent_id",
                    "amount",
                    "currency"
                ],
                "additionalProperties": false,
                "properties": {
                    "recipient_agent_id": {
                        "type": "string"
                    },
                    "amount": {
                        "type": "string",
                        "pattern": "^[0-9]+$"
                    },
                    "currency": {
                        "type": "string"
                    }
                }
            }
        }
    }
}