{
    "protocol_version": "v0.1",
    "receipt_id": "d4e5f6a7b8c9d0e1f2a3b4c5d6e7f8a9b0c1d2e3f4a5b6c7d8e9f0a1b2c3d4e5",
    "timestamp": "2026-02-09T15:00:00Z",
    "related_claim_id": "a1b2c3d4e5f6a7b8c9d0e1f2a3b4c5d6e7f8a9b0c1d2e3f4a5b6c7d8e9f0a1b2",
    "outcome": "valid",
    "evidence_cids": [
        "QmHash1",
        "QmHash2"
    ],
    "payouts": [
        {
            "recipient_agent_id": "agent-007",
            "amount": "500",
            "currency": "ILC"
        }
    ]
}